Resource ID,Resource Name,Resource URL,Description,Archived,Format,Type,Runtime,Subject Areas,Authoring Organization,Intended Audiences,Record Modified,Resource Revised
L003521112,Exploring 3D Molecular Structures with iCn3D,https://www.nlm.nih.gov/ncbi/workshops/2022-10_3d-molecular-structures/workshop-details.html,"The amount of biomolecular structure data produced by researchers is growing rapidly and helping push scientific discovery. Knowledge of biomolecular structure helps scientists understand how the structure works and this knowledge can be used to influence function, predict binding partners, and understand biological pathways. As such, researchers in life sciences can benefit from an increased understanding of biomolecular structure and resources that build upon structural data, which is the focus of this workshop.",false,HTML,Webinar Source Page,108,Genetics and Molecular Biology; NCBI Workshops,"Training Team, NCBI",User; Trainer,11/29/2022 12:00:00 AM,10/18/2022 12:00:00 AM
L004462112,Exploring Evolutionary Relationships Using BLAST,https://www.nlm.nih.gov/ncbi/workshops/2023-08_BLAST_evol/workshop_details.html,"Identification of evolutionarily related DNA or protein sequences (homologs) is a crucial step in many biology workflows. For example, homologous sequences are used to infer relationships between organisms, understand how sequence changes affect observable traits, and identify potential animal models for genetic disorders.   NCBI’s BLAST program is a standard tool for identifying homologs, and this virtual workshop will teach you best practices for using it for your analysis goals. You will learn when and how to use important but often misunderstood aspects of the BLAST programs and databases, such as when it’s helpful to change the BLAST program by using filters and adjusting parameters such as word size, e-value cutoff, and maximum target sequences.",false,HTML,Webinar Source Page,113,Genetics and Molecular Biology; NCBI Workshops,"Training Team, NCBI",User; Trainer,08/25/2023 12:00:00 AM,08/24/2023 12:00:00 AM
L004322112,Exploring the Relationship Between Two Eukaryotic Genomes Using the Comparative Genome Viewer,https://www.nlm.nih.gov/ncbi/workshops/2023-07_comparative-genome-viewer/workshop_details.html,"The Comparative Genome Viewer (CGV) is a visualization tool that helps you quickly compare two genomes based on assembly-assembly alignments provided by NCBI. CGV includes eukaryotic (animal, plant and fungal) assemblies, and many cross-species comparisons. You can view chromosome-scale rearrangements, search for genes, and display aligned regions at the sequence level.",false,HTML,Webinar Source Page,101,Genetics and Molecular Biology; NCBI Workshops,"Training Team, NCBI",User; Trainer,07/25/2023 12:00:00 AM,07/25/2023 12:00:00 AM
L00653080,Final Rule for Clinical Trials Registration and Results Information Submission Webinar Series - 2020,https://clinicaltrials.gov/ct2/manage-recs/present#FinalRuleWebinar,A series of three live webinars provided responsible parties with information about the Final Rule for Clinical Trials Registration and Results Information Submission (42 CFR Part 11).,false,HTML,Page,180,ClinicalTrials.gov,"ClinicalTrials.gov Team, NCBI",User,05/12/2023 12:00:00 AM,04/01/2020 12:00:00 AM
L002981112,Finding & Organizing NCBI Data for your Research Project,https://www.nlm.nih.gov/oet/ed/ncbi/2022_02_ncbidata.html,Workshop provides some tips for new users of NCBI databases on how to effectively search databases and use an NCBI Account to organize key literature and biological data records.,false,HTML,Webinar Source Page,113,My NCBI; NCBI Workshops,"Training Team, NCBI",User; Trainer,04/01/2022 12:00:00 AM,02/22/2022 12:00:00 AM
L002161112,Finding Data for Your Research Organism,https://www.youtube.com/watch?v=ku4YtjV3Sz4,Offers two demonstrations that show you have to find and analyze sequence data for non-model organism.,false,MP4 Video,YouTube Video,47,Terminology; Data Management,"Training Team, NCBI",User,04/29/2021 12:00:00 AM,03/15/2021 12:00:00 AM
L000701112,Finding and Using Health Statistics,https://www.nlm.nih.gov/oet/ed/stats/index.html,"This course describes the range of available health statistics, identifies their sources and helps you understand how to use information about their structure as you search.",false,HTML,Tutorial,,Health Services Research; Public Health; Data Science,Office of Engagement and Training,User,08/18/2023 12:00:00 AM,08/18/2023 12:00:00 AM
L003356112,Fire and Freedom: Food and Enslavement in Early America - Lesson Plans,https://www.nlm.nih.gov/exhibition/fireandfreedom/education/index.html,Fire and Freedom: Food and Enslavement in Early America presents the following classroom resources for K-12 and undergraduate educators and their students. These resources serve as templates for examining foodways with the historical context of European settlement and slavery during early America.,false,HTML,Page,,K-12 Education; History of Medicine,History of Medicine,User; Trainer,09/30/2022 12:00:00 AM,09/30/2022 12:00:00 AM
L000827112,Five Questions You Can Answer Using the NCBI Gene Database,https://www.youtube.com/watch?v=tGP_x9kKABM,"The Gene resource at NCBI is a central hub for accessing nearly all molecular and literature resources for a particular gene. You can easily answer the most common questions and perform the most common tasks by starting in Gene. In this webinar intended for librarians who support NCBI molecular databases, you will learn about the structure and contents of the Gene resource and how to use Gene to answer the following questions about a gene:Where is the gene located (chromosome and position) in the genome assembly?What are the Reference genomic, transcript and protein sequences for the gene?What variations are present in the gene and are they associated with disease?In what tissues and under what conditions is the gene expressed?What are the equivalent genes (homologs) in other species?",false,MP4 Video,YouTube Video,53,,Network of the National Library of Medicine,,06/16/2020 12:00:00 AM,06/16/2020 12:00:00 AM
L000783112,Five ways to submit next-gen sequence data to NCBI's Sequence Read Archive (SRA),https://www.youtube.com/watch?v=VrkQUg8CrW0&feature=youtu.be,"In this webinar you will learn how to use five different ways to submit your next gen sequence data to NCBI's Sequence Read Archive. These include external submission services through Illumina's BaseSpace, MOTHUR (for microbial ecology data) and the iPlant Collaborative. In addition NCBI provides the new SRA submission portal and soon will offer the ability to upload data to SRA through FTP and the Aspera command line client in the new submission portal.",false,MP4 Video,YouTube Video,13,My NCBI; Data Science,"Training Team, NCBI",User,11/14/2018 12:00:00 AM,02/24/2016 12:00:00 AM
L003380112,Folleto tríptico de MedlinePlus,https://www.nnlm.gov/sites/default/files/2021-08/MedlinePLus%20Tri-Fold%20Spanish.pdf,Un folleto tríptico con información introductoria sobre MedlinePlus.,false,PDF,Document,,MedlinePlus,"MedlinePlus Team, LO/PSD/RWS",User; Trainer,10/21/2022 12:00:00 AM,07/01/2019 12:00:00 AM
L003357112,For All the People: A Century of Citizen Action in Health Care Reform - Lesson Plans,https://www.nlm.nih.gov/exhibition/forallthepeople/education/lessonplan.html,"Students first examine and categorize various types of information presented on an online source—“The Power of Medicine” from the For All the People online exhibition. They explore the web content and learn about how some people worked to expand access to health care to more people in the past. Students focus on two health professional leaders in the exhibition—Lillian Wald who founded the Henry Street Settlement, and Dr. Leonidas Berry who was a president of the National Medical Association. The lesson ends with an assignment where students work in small groups to research and prepare class presentations about Leonidas Berry or Lillian Wald.",false,HTML,Page,,K-12 Education; History of Medicine,History of Medicine,User; Trainer,09/30/2022 12:00:00 AM,09/30/2022 12:00:00 AM
L002886112,For Authors (PubMed Central),https://www.ncbi.nlm.nih.gov/pmc/about/submission-methods/,"This page aims to help authors determine whether their paper is eligible for submission to PMC, how it may be deposited, and by whom.",false,HTML,Help Page or FAQ,,PubMed Central; Public Access,"PubMed Central Team, NCBI",User,10/26/2022 12:00:00 AM,03/14/2022 12:00:00 AM
L002801112,Foundations of Citizen Science + Libraries as Community Hubs for Citizen Science,https://www.nnlm.gov/training/class-catalog/foundations-citizen-science-libraries-community-hubs-citizen-science,"What is citizen science? How can I get involved? This 2 hour, on-demand, online class from NNLM and SciStarter.org introduces citizen science for librarians, staff, and community-based organization leaders and includes clear, specific instructions and case studies on how a small, midsize, or large library or organization can bring citizen science activities and programs to their community. This tutorial is available in English and Spanish through scistarter.org.",false,HTML,On-Demand Course,120,Consumer Health; Public Health,Network of the National Library of Medicine,User; Trainer,10/21/2022 12:00:00 AM,10/01/2021 12:00:00 AM
L003345112,Frankenstein: Penetrating the Secrets of Nature - Lesson Plans,https://www.nlm.nih.gov/exhibition/frankenstein/education/index.html,Frankenstein: Penetrating the Secrets of Nature presents the following classroom resources for K-12 and undergraduate educators and their students. The resources offer templates for incorporating the exhibition’s scholarly content in order to help students learn by examining and analyzing primary- and secondary-source visual and textual materials. They promote students’ consideration of science and society as a whole and develop historical perspectives on how scientific endeavors influence as well as are shaped by society and culture. Educators are welcome to adapt these resources in whole or in part as they deem appropriate for students’ interests and learning goals.,false,HTML,Page,,K-12 Education; History of Medicine,History of Medicine,User; Trainer,09/30/2022 12:00:00 AM,10/01/2014 12:00:00 AM
L003358112,From DNA To Beer: Harnessing Nature in Medicine and Industry - Lesson Plan,https://www.nlm.nih.gov/exhibition/fromdnatobeer/education/lesson-plans.html,"This lesson plan uses the “Living Factories” section of the From DNA to Beer site, so that students learn about how horses and other animals were used to develop and produce antitoxin serum in order to prevent children with diphtheria from dying of suffocation. Students learn about and define acquired and passive immunity in animals, as they explore the horse’s immune response to the diphtheria toxin injection and the horse’s antitoxin serum that could prevent death in diphtheria patients.  The lesson plan is developed in collaboration with Samantha Candia (Francis Scott Key Middle School, Silver Spring, MD), with contributions by the 2013 Teacher Institute Participants.",false,HTML,Page,,K-12 Education; History of Medicine,History of Medicine,User; Trainer,09/30/2022 12:00:00 AM,09/30/2022 12:00:00 AM
L000927112,From Movies to Meals: Senior Services and Spaces at Your Local Library,https://youtu.be/AxRh9UmHxz8,"Libraries often are the de facto senior centers of our growing - and aging - communities.  The Marion Public Library embraces this role through program design, community feedback, and strategic partnerships.  In addition to ""traditional"" library programming, the library works to meet the nutritional and social needs of seniors through twice-weekly congregate meals as well as a monthly mobile food pantry visit.Speakers:Dawn Cline is the Outreach Services Coordinator at the Marion Public Library. A Marion native, her work includes serving as the library liaison to multiple community groups. Cline was instrumental in bringing senior meals to the Marion Library Spring 2018.Madeline Jarvis is the Adult and Information Services Coordinator at the Marion Public Library. Her work includes overseeing tween, teen, and adult programming; collection development; and wearing many hats.",false,MP4 Video,Webinar,53,Senior Health,Network of the National Library of Medicine,User,05/28/2020 12:00:00 AM,03/15/2019 12:00:00 AM
L001630112,From Problem to Prevention: Evidence-based public health,https://www.nnlm.gov/training/class-catalog/problem-prevention-evidence-based-public-health,"Curious about evidence-based public health (EBPH) but not sure where to start? This 1 hour webinar explains the basics of evidence-based public health (EBPH) and highlight essentials of the EBPH process such as identifying the problem, forming a question, searching the literature, and evaluating the intervention.  The purpose of this class is to provide an introduction to the world of evidence based public health and to give those already familiar with EBPH useful information that can be applied in their practices.Curious about evidence-based public health (EBPH) but not sure where to start? This 1 hour webinar explains the basics of evidence-based public health (EBPH) and highlight essentials of the EBPH process such as identifying the problem, forming a question, searching the literature, and evaluating the intervention.  The purpose of this class is to provide an introduction to the world of evidence based public health and to give those already familiar with EBPH useful information that can be applied in their practices.",false,HTML,On-Demand Course,60,Public Health,Network of the National Library of Medicine,User,10/21/2022 12:00:00 AM,02/26/2020 12:00:00 AM
L004243112,Fundamentals of Health Sciences Research Data Management,https://www.nnlm.gov/training/class-catalog/fundamentals-health-sciences-research-data-management,"This class is designed to provide information professionals, working in health sciences, with an introduction to research data management. The primary goal of this course is to improve your knowledge and skills in research data management and enable you to add or enhance research data management training and services at your institution.  This 8-week course will have participants read foundational texts in research data management, engage in discussions with other participants, complete assignments designed to improve knowledge and skills, and develop a final project of teaching a concept from the course or delivering a presentation on library roles in research data management.  Participants will work with course facilitators and community experts to complete course assignments and gain an understanding of the role of research data management in libraries.  When this class is offered, participation will be capped at 60, so if you are interested in applying to register for this course, please commit to spending 3 total hours per week engaging with the course readings and assignments.",false,HTML,Page,,Data Management,Network of the National Library of Medicine,User; Trainer,07/06/2023 12:00:00 AM,06/07/2023 12:00:00 AM
L00231080,Fundamentals of the NLM Classification Tutorial,https://www.nlm.nih.gov/tsd/cataloging/trainingcourses/classification/intro_010.html,A 9-module training course on using the NLM classification.,false,HTML,Tutorial,,NLM Classification,"Cataloging and Metadata Management Section, LO/TSD",User,04/19/2021 12:00:00 AM,04/16/2021 12:00:00 AM
L00608080,GEO2R: Analyze GEO Data,https://www.youtube.com/watch?v=EUPmGWS8ik0,A tutorial on how to use GEO2R to analyze microarray data in GEO and retrieve a list of differentially expressed genes.,false,MP4 Video,YouTube Video,5,Genetics and Molecular Biology; Developmental Biology; Microbiology; Immunology; Agriculture; Cancer,"Training Team, NCBI",User,06/15/2020 12:00:00 AM,04/23/2012 12:00:00 AM
L00596080,GenBank Submissions,https://www.youtube.com/playlist?list=PL7dF9e2qSW0ZqrXzouzddPYXXZdbr-RCz,"A series of webinars presented from December 17, 2014 to April 13, 2016 outlining use of BankIt, a web-based submission tool at NCBI to submit sequence data to the GenBank database.",false,MP4 Video,YouTube Video,58,Genetics and Molecular Biology; Bioinformatics; Developmental Biology; Microbiology; Immunology; Agriculture; Cancer,"Training Team, NCBI",User,10/13/2022 12:00:00 AM,03/05/2021 12:00:00 AM
L001763112,General Pilot FAQs,https://www.ncbi.nlm.nih.gov/pmc/about/nihpreprints-faq/#genfaq,"A look at some of the details of pilot implementation, such as inclusion in PubMed, and search strategies.",false,HTML,Page,,PubMed Central; Preprints,"PubMed Central Team, NCBI",User,01/25/2023 12:00:00 AM,01/24/2023 12:00:00 AM
L004501112,Genetic Testing Registry (GTR) Submission Portal Improvements,https://www.youtube.com/watch?v=FjdLZ8oWkEQ,This video describes improvements to the GTR Submission Portal. These changes are designed to streamline your submissions and provide a more intuitive submission experience. Detailed examples of the improvements are provided.,false,MP4 Video,YouTube Video,5,Genetics and Molecular Biology,"Training Team, NCBI",User; Trainer,09/25/2023 12:00:00 AM,09/19/2023 12:00:00 AM
L00604080,Genetic Testing Registry Tutorials,https://www.youtube.com/playlist?list=PL1C4A2AFF811F6F0B,"Tutorials on how to use NCBI's Genetic Testing Registry including navigating the home page, basic and advanced search functions, locating tests, and migrating laboratory and test data from GeneTests to GTR.",false,MP4 Video,YouTube Video,27,Genetics and Molecular Biology; Developmental Biology; Cancer,"Training Team, NCBI",User,06/15/2020 12:00:00 AM,03/20/2015 12:00:00 AM
L002365112,Genetics 101,https://www.nnlm.gov/training/class-catalog/genetics-101-0,"This class is intended to cover the fundamentals of understanding genetics specifically the Central Dogma of Molecular Biology and is geared toward medical, hospital, and academic librarians, but everyone is welcome. This is an online, asynchronous class.",false,HTML,Tutorial Source Page,,Genetics and Molecular Biology; Other,Network of the National Library of Medicine,User; Trainer,10/21/2022 12:00:00 AM,08/24/2021 12:00:00 AM
L001531112,Genome Data Viewer: Analyzing Remote BAM Alignment Files and Other Tips,https://www.youtube.com/watch?v=KaLgr6dIcQs,"This video shows you how to upload remote BAM files, and succinctly demonstrates handy viewer settings, such as Pileup display options, and highlights the very helpful tooltips.",false,MP4 Video,YouTube Video,,Genetics and Molecular Biology,"Training Team, NCBI",User,06/17/2020 12:00:00 AM,01/08/2020 12:00:00 AM
L002141112,"Genome Data Viewer: Introducing Table View, a New Way to Navigate Assemblies",https://www.youtube.com/watch?v=QJRAoUChK3w,"Provides a very brief refresher on the Genome Data Viewer's home page, then introduces a new way to view and download assemblies. Table view offers an  easier way to see all the assemblies available for one organism, and for larger taxonomic groups.",false,MP4 Video,YouTube Video,3,Genetics and Molecular Biology; Other,"Training Team, NCBI",User,04/29/2021 12:00:00 AM,03/05/2021 12:00:00 AM
L002081112,Genome Data Viewer: Navigate Exons and Find CDS Positions,https://www.youtube.com/watch?v=EVNABwOCt_s,"Shows you different ways to explore exons in gene transcripts, find CDS and protein positions, use HGVS-like expressions to locate positions, and download exon sequence.",false,MP4 Video,YouTube Video,4,Genetics and Molecular Biology; Other,"Training Team, NCBI",User,04/29/2021 12:00:00 AM,02/04/2021 12:00:00 AM
L001521112,Genome Data Viewer: Tips for Zooming to Chromosomal Regions,https://www.youtube.com/watch?v=4WRUNovZ-aA&t=2s,"The Genome Data Viewer, or GDV, is NCBI's genome browser. We continue to update and add new functions, including the Chromosome Region Selector, the focus of this video.",false,MP4 Video,YouTube Video,,Genetics and Molecular Biology,"Training Team, NCBI",User,06/17/2020 12:00:00 AM,06/12/2020 12:00:00 AM
L00605080,Genome Workbench Tutorials,https://www.youtube.com/playlist?list=PL7dF9e2qSW0aQs_Id9JxVoeVKlMrtxTsq,"Tutorials on the Genome Workbench including using phylogenetic trees, using ProSplign, loading a genome, and searching and viewing a gene.",false,MP4 Video,YouTube Video,95,Genetics and Molecular Biology; Bioinformatics; Developmental Biology; Microbiology; Immunology; Agriculture; Cancer,"Training Team, NCBI",User,07/29/2022 12:00:00 AM,07/29/2022 12:00:00 AM
L002644112,Genome Workbench: Update Sequence,https://www.youtube.com/watch?v=1SQ9tGxM4Bs,How to update your GenBank sequences with new annotation or sequence.,false,MP4 Video,YouTube Video,7,Genetics and Molecular Biology; Other,"Training Team, NCBI",User; Trainer,12/29/2021 12:00:00 AM,11/26/2021 12:00:00 AM
L000742112,Genomic Data Sharing Policy and dbGaP submissions,https://www.youtube.com/watch?v=aGnFLTHCE04&feature=youtu.be,"In this webinar, presented mainly for NIH intramural investigators engaged in GWAS and other genomic research efforts at NIH, you will learn about working with your Genomics Program Administrator to register your study in dbGaP and how to prepare your project metadata files, phenotypes, and molecular data for submission to dbGaP. Although this presentation is intended for NIH intramural researchers, it will also help those outside NIH who plan to submit data to dbGaP.",false,MP4 Video,YouTube Video,49,My NCBI,"Training Team, NCBI",Developer,06/15/2020 12:00:00 AM,02/08/2016 12:00:00 AM
L003142112,Getting Started with NCBI Data in Python,https://www.nlm.nih.gov/oet/ed/ncbi/2022_04_python.html,"On April 19, the NCBI Education Team provided a workshop on Getting Started with NCBI Data in Python. Training materials from this event are available on this page.",false,HTML,Webinar Source Page,168,Genetics and Molecular Biology; NCBI Workshops,"Training Team, NCBI",User; Trainer,07/15/2022 12:00:00 AM,04/19/2022 12:00:00 AM
L002807112,Getting Started with NCBI Data in Python,https://www.nlm.nih.gov/oet/ed/ncbi/2021_12_python.html,"On December 14, the NCBI Education Team provided a workshop on Getting Started with NCBI Data in Python. Training materials from this event are available on this page.  Learn how to tackle bigger biomolecular datasets more reliably with the power of Python programming. This workshop is designed for biologists without programming experience. Our examples will use genomic, transcript, and protein sequence data, but the programming skills will be broadly relevant for all biologists.",false,HTML,Webinar Source Page,167,Genetics and Molecular Biology; NCBI Workshops,"Training Team, NCBI",User,02/18/2022 12:00:00 AM,12/14/2021 12:00:00 AM
L002321112,Getting the Full Picture with ClinicalTrials.gov,https://www.nlm.nih.gov/oet/ed/ct/full_picture.html,"Kristina Elliott from the National Library of Medicine discusses the role of <a href=""https://clinicaltrials.gov/"">ClinicalTrials.gov</a> in making the results of clinical research transparent to the public. This presentation was created for the 2018 Medical Library Association (MLA) Annual meeting.",false,MP4 Video,Video Tutorial,15,ClinicalTrials.gov,Office of Engagement and Training,User; Trainer,08/10/2021 12:00:00 AM,05/13/2018 12:00:00 AM
L002961112,Getting the Most Out of DOCLINE,https://www.youtube.com/watch?v=uui_qW1-0qo,"A 30 minute webinar on the features of DOCLINE, the interlibrary loan request routing system.",false,MP4 Video,YouTube Video,28,DOCLINE,Network of the National Library of Medicine,User,03/31/2022 12:00:00 AM,05/13/2020 12:00:00 AM
L000884112,Getting the Right Information to Patients Using MedlinePlus Connect,https://www.nlm.nih.gov/bsd/disted/video/clin_info/medline_plus_connect.html,"As part of the series, Clinical Information, Librarians and the NLM: from Health Data Standards to Better Health, Jennifer Jentsch from the MedlinePlus team at the U.S. National Library of Medicine describes how terminology standards make patient educational materials accessible through electronic health record systems, health apps, and other systems via MedlinePlus Connect.",false,MP4 Video,Webinar,28,MedlinePlus; Terminology; Clinical Medicine,Office of Engagement and Training,User; Developer,06/17/2020 12:00:00 AM,11/25/2019 12:00:00 AM
L000973112,Getting the Right Information to Patients Using MedlinePlus Connect: Tutorial,https://www.nnlm.gov/training/class-catalog/getting-right-information-patients-using-medlineplus-connect,"This one-hour training session with videos and exercises is intended to introduce you to what MedlinePlus Connect does and how, and point you to resources for implementing MedlinePlus Connect at your institution.",false,HTML,On-Demand Course,60,MedlinePlus; Clinical Medicine; Consumer Health; Health Care Technology,Office of Engagement and Training,User; Trainer; Developer,10/21/2022 12:00:00 AM,09/01/2021 12:00:00 AM
L001641112,Grants and Proposal Writing-On Demand,https://www.nnlm.gov/training/class-catalog/how-apply-nnlm-funding,"Designed for beginning grant proposal writers, this class presents a general overview of the grant and funding processes as well as the level of detail required in a successful proposal.",false,HTML,On-Demand Course,,Data Science,Network of the National Library of Medicine,User,05/08/2023 12:00:00 AM,10/28/2021 12:00:00 AM
L003346112,Graphic Medicine & Mental Health - Lesson Plan,https://www.nlm.nih.gov/exhibition/graphicmedicine/education-lessonplan1.html,"Students explore the graphic novel format used for personal stories of illnesses, known as graphic medicine.",false,HTML,Page,,K-12 Education; History of Medicine,History of Medicine,User; Trainer,09/30/2022 12:00:00 AM,09/30/2022 12:00:00 AM
