Resource ID,Resource Name,Resource URL,Description,Archived,Format,Type,Runtime,Subject Areas,Authoring Organization,Intended Audiences,Record Modified,Resource Revised
L000930112,"Meeting Local Health Literacy Needs with NNLM Funding Support: University of Virginia Health Sciences Library Outreach in Charlottesville, Virginia, U.S.A",https://www.youtube.com/watch?v=_-4A3HFuQHo&feature=youtu.be,"Presenters: Lydia Witman, MLISAbstract: Meeting Local Health Literacy Needs with NNLM Funding Support: University of Virginia Health Sciences Library Outreach in Charlottesville, Virginia, U.S.A. describes our experience, including successes and challenges, of recently completed collaborative work. The University of Virginia (UVA) Health Sciences Library received two Health Information Outreach awards from NNLM SEA, located at the University of Maryland, Baltimore. Over the span of 1.5 years, UVA partnered with local and regional non-profit and public organizations to create new or enhanced health literacy programming and services in the local health district. The grants were administered and partnerships developed by Lydia Witman, a UVA medical librarian who is a health literacy advocate and consumer health specialist, and who manages the hospital's Patient & Family Library. Local partner organizations included the city's mental health and wellness coalition, the regional public library system, and more.The librarian was able to support the needs of the community by helping community-based organizations identify their own needs and formulate their own solutions. Not only were organizations educated about what health literacy is and how it affects health outcomes and well-being, they were also given grant funds to complete health literacy-related work with the populations they serve.  Instead of creating a prefabricated program, service, or learning experience, the librarian listened to the needs of each organization and helped them formulate their own plans. Providing contacts and connections was also valuable; for example, one organization working with refugees and other vulnerable populations wanted to focus on creating Arabic and Spanish language translations of some of their print material; the librarian was able to provide a list of recommended translation vendors for health-related documents. The librarian was able to steer organizations toward ideal practices such as including members of the intended audience in the planning and design phases, and assessing the success of interventions. Presenter Bio: Lydia Witman, MLIS, is a medical librarian specializing in consumer health information and health literacy. She currently manages the Patient & Family Library service at the UVA Health System, and chairs the health systemHealth Literacy Workgroup, a subset of the larger Patient & Family Education Committee. Over the past 10 years working in hospitals and health systems, she has educated hundreds of health care providers and staff about the importance of clear communication, and helped raised awareness about health literacy. Recently, she received two grants from the NLM/NNLM for community-based health literacy interventions in partnership with local and regional non-profit and public service organizations. She is exploring the possibility of research into outcomes associated with Information Prescription orders placed by clinicians at the bedside.",false,MP4 Video,Webinar,54,Consumer Health,Network of the National Library of Medicine,User; Trainer,05/28/2020 12:00:00 AM,03/15/2019 12:00:00 AM
L000929112,"Meeting Local Health Literacy Needs with NNLM Funding Support: University of Virginia Health Sciences Library Outreach in Charlottesville, Virginia, U.S.A",https://youtu.be/_-4A3HFuQHo,"Presenters: Lydia Witman, MLISAbstract: Meeting Local Health Literacy Needs with NNLM Funding Support: University of Virginia Health Sciences Library Outreach in Charlottesville, Virginia, U.S.A. describes our experience, including successes and challenges, of recently completed collaborative work. The University of Virginia (UVA) Health Sciences Library received two Health Information Outreach awards from NNLM SEA, located at the University of Maryland, Baltimore. Over the span of 1.5 years, UVA partnered with local and regional non-profit and public organizations to create new or enhanced health literacy programming and services in the local health district. The grants were administered and partnerships developed by Lydia Witman, a UVA medical librarian who is a health literacy advocate and consumer health specialist, and who manages the hospital's Patient & Family Library. Local partner organizations included the city's mental health and wellness coalition, the regional public library system, and more.The librarian was able to support the needs of the community by helping community-based organizations identify their own needs and formulate their own solutions. Not only were organizations educated about what health literacy is and how it affects health outcomes and well-being, they were also given grant funds to complete health literacy-related work with the populations they serve.  Instead of creating a prefabricated program, service, or learning experience, the librarian listened to the needs of each organization and helped them formulate their own plans. Providing contacts and connections was also valuable; for example, one organization working with refugees and other vulnerable populations wanted to focus on creating Arabic and Spanish language translations of some of their print material; the librarian was able to provide a list of recommended translation vendors for health-related documents. The librarian was able to steer organizations toward ideal practices such as including members of the intended audience in the planning and design phases, and assessing the success of interventions. Presenter Bio: Lydia Witman, MLIS, is a medical librarian specializing in consumer health information and health literacy. She currently manages the Patient & Family Library service at the UVA Health System, and chairs the health system Health Literacy Workgroup, a subset of the larger Patient & Family Education Committee. Over the past 10 years working in hospitals and health systems, she has educated hundreds of health care providers and staff about the importance of clear communication, and helped raised awareness about health literacy. Recently, she received two grants from the NLM/NNLM for community-based health literacy interventions in partnership with local and regional non-profit and public service organizations. She is exploring the possibility of research into outcomes associated with Information Prescription orders placed by clinicians at the bedside.",false,MP4 Video,Webinar,54,Medical Subject Headings (MeSH),Network of the National Library of Medicine,Developer,06/16/2020 12:00:00 AM,07/28/2020 12:00:00 AM
L000602112,MetamorphoSys. Rich Release Format (RRF) Browser: Cluster Views,https://www.nlm.nih.gov/research/umls/user_education/quick_tours/MMSys/ClusterViewsN.html,"Tutorial explaining how to search for data within Concept, Code, Source Concept and Source Descriptor clusters using the MetamorphoSys tool that comes with the distribution of the Unified Medical Language System (UMLS).",false,MP4 Video,Video Tutorial,2,Unified Medical Language System (UMLS); Terminology,"UMLS Team, LO/BSD/MMS",User; Trainer,06/26/2018 12:00:00 AM,06/22/2018 12:00:00 AM
L000603112,MetamorphoSys. Rich Release Format (RRF) Browser: Highlight Search Results.,https://www.nlm.nih.gov/research/umls/user_education/quick_tours/MMSys/HighlightSearchResultsN.html,Tutorial explaining how to customize visualization of search results by applying highlighting of search results by specific terminology sources or content views.,false,MP4 Video,Video Tutorial,2,Unified Medical Language System (UMLS); Terminology,"UMLS Team, LO/BSD/MMS",User; Trainer,06/26/2018 12:00:00 AM,05/02/2018 12:00:00 AM
L000643112,MetamorphoSys. Rich Release Format (RRF) Browser: “Refine Search By” Feature.,https://www.nlm.nih.gov/research/umls/user_education/quick_tours/MMSys/refineSearchByN.html,"This tutorial demonstrates how to refine your search by specific sources, content views, or semantic types within the MetamorphoSys RRF Browser.",false,MP4 Video,Video Tutorial,2,Unified Medical Language System (UMLS); Terminology,"UMLS Team, LO/BSD/MMS",User; Trainer,10/12/2018 12:00:00 AM,05/03/2018 12:00:00 AM
L00248080,MetamorphoSys. Rich Release Format Browser: Find a Code From a CUI,https://www.nlm.nih.gov/research/umls/user_education/quick_tours/MMSys/codeFromCUI_N.html,This tutorial demonstrates how to search with CUIs to retrieve source codes within the MetamorphoSys RRF Browser.,false,MP4 Video,Quick Tour,2,Unified Medical Language System (UMLS); Terminology,"UMLS Team, LO/BSD/MMS",User; Trainer,03/03/2022 12:00:00 AM,09/15/2015 12:00:00 AM
L000601112,MetamorphoSys. Rich Release Format Browser: Search By Code.,https://www.nlm.nih.gov/research/umls/user_education/quick_tours/MMSys/MMSSearchByCode.html,A tutorial that explains how to perform searches by code using the MetamorphoSys tool that is an essential part of UMLS distribution.,false,MP4 Video,Video Tutorial,1,Unified Medical Language System (UMLS); Terminology,"UMLS Team, LO/BSD/MMS",User; Trainer,06/26/2018 12:00:00 AM,04/18/2018 12:00:00 AM
L000921112,Midday at the Oasis: What to do after You Take a Data Course,https://youtu.be/y_ZQwPYqDEQ,"This is a joint webinar of PSR's Midday at the Oasis and PNR Rendezvous! Each of us hosts a webinar on the third Wednesday of the Month! Summary: There are many online and in-person courses available for librarians to learn about research data management, data analysis, and visualization, but after you have taken a course, how do you go about applying what you have learned? While it is possible to just start offering classes and consultations, your service will have a better chance of becoming relevant if you consider stakeholders and review your institutional environment. This lecture will give you some ideas to get started with data services at your institution.Presenter Bio: Margaret Henderson is the Health Sciences Librarian at San Diego State University Library. She is liaison to the College of Health and Human Services and is also working with other Librarians at SDSU to set up RDM services. She is also one of the instructors for the â€œBiomedical & Health Research Data Management for Librariansâ€ courses  sponsored by the National Library of Medicine (NLM) and the National Network of Libraries of Medicine Training Office (NTO) Previously, she spent three and a half years setting up RDM services at Virginia Commonwealth University Libraries. Margaret has been a biomedical librarian for over 30 years and is a Distinguished member of the Academy of Healthcare Information Professionals. She has presented and written on many library topics over the years, and wrote the book, Data Management: A Practical Guide for Librarians (2016, Rowman & Littlefield).",false,MP4 Video,Webinar,55,Data Science,Network of the National Library of Medicine,User,05/28/2020 12:00:00 AM,03/15/2019 12:00:00 AM
L002885112,My Bibliography,https://youtu.be/SpFcC0eRk8Q,"A brief introduction to the new My Bibliography page released in May, 2019.",false,MP4 Video,YouTube Video,2,My NCBI; Public Access,"Training Team, NCBI",User,03/14/2022 12:00:00 AM,05/03/2019 12:00:00 AM
L001535112,My NCBI,https://www.youtube.com/watch?v=fTlGVPXLXeE,"This is an updated introduction to your free My NCBI account. Learn how to navigate and change settings for your saved PubMed searches, Collections, My Bibliography, BLAST searches, and more",false,MP4 Video,YouTube Video,,My NCBI,"Training Team, NCBI",User,06/17/2020 12:00:00 AM,10/23/2019 12:00:00 AM
L004583112,NCBI BLAST: Identifying Sequences: An NLM Navigator,https://www.nlm.nih.gov/oet/ed/navigator/blast-ident/launch.html,This interactive tutorial walks you through your first BLAST to identify the source of a DNA or RNA sequence.,false,HTML,Tutorial,15,Genetics and Molecular Biology; Bioinformatics,Office of Engagement and Training,User,10/25/2023 12:00:00 AM,10/20/2023 12:00:00 AM
L004641112,NCBI ClinVar: Clinical Variation: An NLM Navigator,https://www.nlm.nih.gov/oet/ed/navigator/clinvar/launch.html,This tutorial guides you through finding relevant genetic variations associated with human health and the evidence linking the variation to clinical observations.,false,HTML,Tutorial,10,Genetics and Molecular Biology; Bioinformatics; Clinical Medicine,Office of Engagement and Training,User,11/03/2023 12:00:00 AM,11/03/2023 12:00:00 AM
L001901112,"NCBI Datasets CoLab Presentation, ASHG2020",https://youtu.be/79IakxFuNaQ,This video is an introduction to and tutorial for the Datasets resource at the National Center for Biotechnology Information (NCBI).,false,MP4 Video,YouTube Video,13,Genetics and Molecular Biology; Bioinformatics; Data Science,"Training Team, NCBI",User,12/01/2020 12:00:00 AM,11/02/2020 12:00:00 AM
L004586112,NCBI Gene: Finding Gene Expression Data: An NLM Navigator,https://www.nlm.nih.gov/oet/ed/navigator/gene-express/launch.html,"This interactive tutorial shows how to find in what tissues and under what conditions a gene is expressed, and to find tissue-specific expression of gene variants.",false,HTML,Tutorial,20,Genetics and Molecular Biology; Bioinformatics,Office of Engagement and Training,User,10/25/2023 12:00:00 AM,10/20/2023 12:00:00 AM
L004587112,NCBI Gene: Finding and Exploring Variations: An NLM Navigator,https://www.nlm.nih.gov/oet/ed/navigator/gene-variation/launch.html,This interactive tutorial demonstrates how to find variations that are present in the gene and explore their known associations with disease using the NCBI Gene database.,false,HTML,Tutorial,20,Genetics and Molecular Biology; Bioinformatics,Office of Engagement and Training,User,10/25/2023 12:00:00 AM,10/20/2023 12:00:00 AM
L004584112,NCBI Gene: Finding the Gene in the Genome: An NLM Navigator,https://www.nlm.nih.gov/oet/ed/navigator/gene/launch.html,This interactive tutorial guides you through how to find the genes are involved in a specific region of the genome given a chromosomal location.,false,HTML,Tutorial,10,Genetics and Molecular Biology; Bioinformatics,Office of Engagement and Training,User,10/25/2023 12:00:00 AM,10/20/2023 12:00:00 AM
L004585112,NCBI Gene: Finding the Reference Sequences: An NLM Navigator,https://www.nlm.nih.gov/oet/ed/navigator/gene-refseq/launch.html,"This interactive tutorial shows how to use the NCBI Gene Database to find the reference genomic, transcript and protein sequences for a gene given the gene name or symbol and species.",false,HTML,Tutorial,15,Genetics and Molecular Biology,Office of Engagement and Training,User,10/25/2023 12:00:00 AM,10/20/2023 12:00:00 AM
L000788112,NCBI Human Variation and Medical Genetics Resources,https://www.youtube.com/watch?v=zdIg7zGNkbg&feature=youtu.be,"Through this webinar, you will learn to use and access resources associated with human sequence variations and phenotypes associated with specific human genes and phenotypes. The webinar will emphasize the Gene, MedGen and ClinVar resources to search by gene, phenotype and and variant respectively. You will learn how to map variation from dbSNP and dbVAR onto genes, transcripts, proteins, and genomic regions and how to find genetic tests in GTR. You will also gain experience using additional tools and viewers including PheGenI, a browser for genotype associations, the Variation Viewer and the 1000 Genomes Browser. These provide useful ways to search for, map and browse variants as well as upload and download data in genomic context.",false,MP4 Video,YouTube Video,63,Genetics and Molecular Biology; My NCBI,"Training Team, NCBI",User,11/14/2018 12:00:00 AM,05/31/2016 12:00:00 AM
L00541080,NCBI Learn,https://www.ncbi.nlm.nih.gov/home/learn/,"The catalog of NCBI Webinars and Courses, Conferences and Presentations, Tutorials and Documentation. (Note: For PubMed resources, see https://www.nlm.nih.gov/bsd/disted/pubmed.html)",false,HTML,Directory,,Genetics and Molecular Biology; Bioinformatics,"Training Team, NCBI",User,01/26/2023 12:00:00 AM,01/01/2023 12:00:00 AM
L004601112,NCBI MedGen: An NLM Navigator,https://www.nlm.nih.gov/oet/ed/navigator/medgen/launch.html,"This interactive tutorial provides a tour of the NCBI MedGen database, which provides vocabulary, background information, and links to detailed information about medical genetics.",false,HTML,Tutorial,10,Genetics and Molecular Biology; Bioinformatics,Office of Engagement and Training,User,11/01/2023 12:00:00 AM,11/01/2023 12:00:00 AM
L001537112,NCBI Minute: A Beginner's Guide to Genes and Sequences at NCBI,https://www.youtube.com/watch?v=QIZ8QH6JcC8,"Interested in learning about genes and sequences but don't know how to begin? This webinar, intended for people with limited experience working with sequence information, will provide you with basic knowledge on how to find and compare nucleotide and protein sequences. You will learn about the kinds of data available for genes and sequences, how to select the most informative records, and how to find related genes and sequences using pre-computed information and the BLAST sequence search service.",false,MP4 Video,YouTube Video,,Genetics and Molecular Biology,"Training Team, NCBI",User,06/17/2020 12:00:00 AM,09/16/2019 12:00:00 AM
L001904112,NCBI Minute: A New Way to Prepare Genome Submissions for GenBank Using Genome Workbench,https://youtu.be/rvEm1Q0KKiM,"To help you prepare for the upcoming retirement of Sequin in January 2021, we show you a new way to prepare genome submissions for GenBank using Genome Workbench. You will learn how to use Genome Workbench's Submission Wizard, Validation and Submitter Reports, Flat File View, and Graphical Sequence View to prepare your annotated genome submission to GenBank and find and fix any problems before submitting.",false,MP4 Video,YouTube Video,35,Genetics and Molecular Biology; Bioinformatics,"Training Team, NCBI",User,12/01/2020 12:00:00 AM,11/23/2020 12:00:00 AM
L004081112,NCBI Minute: Accessing NCBI AMR Pathogen Data in the Cloud,https://www.youtube.com/watch?v=j4dzFOo2FmI,"This 30 minute webinar describes how to access antimicrobial resistance (AMR) data from NCBI's Pathogen Detection resource.  The Pathogen Detection team uses Google BigQuery to present tables of data in the cloud, and this webinar shows you how to access these tables.  You will also learn about AMRFinderPlus and how it is used to identify anti-microbial resistance genes, point mutations, variants and stress resistance genes.",false,MP4 Video,YouTube Video,27,NCBI Workshops,"Training Team, NCBI",User; Trainer,04/24/2023 12:00:00 AM,04/18/2023 12:00:00 AM
L001536112,NCBI Minute: An Insider's Guide to the New My Bibliography,https://www.youtube.com/watch?v=DDHkAVQ5dDQ,"My Bibliography is a central place to save and share your citations. You can add PubMed citations, create them manually, or upload them from citation managers. In this webinar you will learn how to navigate the new interface, receive a few helpful tips to make your experience easier, get a sneak peek of features under development, and learn how you can help us improve My Bibliography by providing feedback.",false,MP4 Video,YouTube Video,,My NCBI,"Training Team, NCBI",User,06/17/2020 12:00:00 AM,09/28/2019 12:00:00 AM
L002121112,NCBI Minute: Changes Are Coming To The Way You Log Into Your NCBI Account,https://www.youtube.com/watch?v=glwhkkWiq8U,"Shows how to register for a free login.gov account, how to link this to an existing NCBI account, and where to find the most up-to-date information and FAQs on this topic.",false,MP4 Video,YouTube Video,13,My NCBI; Other,"Training Team, NCBI",User; Trainer,04/29/2021 12:00:00 AM,03/05/2021 12:00:00 AM
L002887112,"NCBI Minute: ElasticBLAST, A New Tool to Help You Run BLAST Searches on the Cloud",https://www.youtube.com/watch?v=4adTdV_patk,"In this webinar you will  learn about ElasticBLAST, a new tool that runs your BLAST searches on cloud hardware, using the standard BLAST command-line package.",false,MP4 Video,YouTube Video,29,My NCBI; Other,"Training Team, NCBI",User,03/14/2022 12:00:00 AM,02/16/2022 12:00:00 AM
L002181112,NCBI Minute: Enhancements to BLAST and Primer-BLAST,https://www.youtube.com/watch?v=LnkNhyTz4lo,Webinar on recent changes to BLAST and Primer-BLAST.,false,MP4 Video,YouTube Video,42,Genetics and Molecular Biology,"Training Team, NCBI",User; Trainer,04/30/2021 12:00:00 AM,04/07/2021 12:00:00 AM
L001522112,NCBI Minute: Exploring SRA Metadata in the Cloud with BigQuery,https://www.youtube.com/watch?v=DkNz-RCCm-M,"NCBI staff will show you how to use Google's BigQuery to quickly search the data from the Sequence Read Archive (SRA) database to speed up your bioinformatic research and discovery projects. BigQuery is a tool that enables you to explore cloud-based data tables with SQL-like queries. In this webinar, we introduce you to using BigQuery to mine SRA submitter-supplied metadata and the results of taxonomic analysis for SRA runs. You'll see real-world case studies that show how find key information about SRA runs and identify data sets for your own analysis pipelines.",false,MP4 Video,YouTube Video,,Genetics and Molecular Biology,"Training Team, NCBI",User,06/17/2020 12:00:00 AM,05/20/2020 12:00:00 AM
L002384112,NCBI Minute: Finding Data for your Research Organism: Plants and RNA-Seq,https://www.youtube.com/watch?v=BBBKt7Z3bt8,"Learn how to use NCBI's web resources, find and access gene and sequence data from Datasets and other NCBI web resources, as well as sample metadata and gene expression RNA-Seq data from SRA and the SRA Run Selector. Also see an example that highlights how to use these data in a typical workflow set up in a Jupyter notebook.",false,MP4 Video,YouTube Video,33,Genetics and Molecular Biology; Other,"Training Team, NCBI",User; Trainer,09/13/2021 12:00:00 AM,08/24/2021 12:00:00 AM
L001576112,NCBI Minute: Five Teaching Examples Using BLAST,https://www.youtube.com/watch?v=JKD5laNtwSc&t=5s,"Sequence similarity search tools such as BLAST are fundamental to modern biology and are now taught to students in undergraduate biology classes or earlier. We have many standard demonstrations that we use to highlight the features of BLAST. These examples are also useful for teaching biology principles and techniques including evolution, taxonomy, homology, multiple sequence alignment, phylogenetic trees, primer design and gene expression analysis. This webinar will provide you with examples using NCBI BLAST that explore these principles and techniques that you can readily adapt to your classrooms.",false,MP4 Video,YouTube Video,,Genetics and Molecular Biology,"Training Team, NCBI",User,06/18/2020 12:00:00 AM,07/31/2019 12:00:00 AM
L000722112,NCBI Minute: Five Teaching Examples using NCBI BLAST,https://www.youtube.com/watch?v=JKD5laNtwSc&feature=youtu.be,"Sequence similarity search tools such as BLAST are fundamental to modern biology and are now taught to students in undergraduate biology classes or earlier. We have many standard demonstrations that we use to highlight the features of BLAST. These examples are also useful for teaching biology principles and techniques including evolution, taxonomy, homology, multiple sequence alignment, phylogenetic trees, primer design and gene expression analysis. This webinar will provide you with examples using NCBI BLAST that explore these principles and techniques that you can readily adapt to your classrooms",false,MP4 Video,Webinar,30,Genetics and Molecular Biology; Bioinformatics,"Training Team, NCBI",User,05/28/2020 12:00:00 AM,07/25/2018 12:00:00 AM
L001578112,NCBI Minute: Getting the Genomic Context for BLAST Protein Matches,https://www.youtube.com/watch?v=5ueWbp0tVvA,"Do you ever want to see the flanking genes of a protein match from a BLAST search? While this genomic context is invisible in protein-protein BLAST results, it is only a few clicks away. In this webinar you will learn to view the genomic context of bacterial proteins using the identical protein report and the graphical sequence viewer. You will also learn to use these reports in detail and see how to retrieve and analyze them using EDirect.",false,MP4 Video,YouTube Video,,Genetics and Molecular Biology,"Training Team, NCBI",User,06/18/2020 12:00:00 AM,06/28/2018 12:00:00 AM
L001570112,NCBI Minute: Getting the Most from Track Hubs in NCBI's Genome Data Viewer,https://www.youtube.com/watch?v=PXYOV3oswB8,"We first made Track Hubs available in Genome Data Viewer (GDV) in June 2018 and continue to improve and refine how they function. This webinar, intended for both new and experienced Track Hub users, will describe what Track Hubs are and how they can help you in your research. You will see how to find Hubs of interest easily through a browser-integrated search of the Track Hub Registry. You learn how you can use Track Hubs together with NCBI-provided tracks to help you analyze aspects of a particular gene or protein. You will also see how you can share your GDV tracks, including those added from Track Hubs, with your peers.",false,MP4 Video,YouTube Video,,Genetics and Molecular Biology,"Training Team, NCBI",User,06/18/2020 12:00:00 AM,12/05/2018 12:00:00 AM
