Resource ID,Resource Name,Resource URL,Description,Archived,Format,Type,Runtime,Subject Areas,Authoring Organization,Intended Audiences,Record Modified,Resource Revised
L00691080,2018 MeSH Highlights,https://www.nlm.nih.gov/bsd/disted/clinics/mesh_2018.html,"On January 5, 2018, NLM staff provided a highlights tour of the 2018 Medical Subject Headings (MeSH). A 20-minute presentation featured a deleted subheading; new publication types; isotope and radioisotope terminology updates; additional terminology for viruses, smoking, and sugars; and restructuring in the plant and animal terminology. Following the presentation, Indexing and MeSH experts answered user questions.",false,MP4 Video,Webinar,21,Medical Subject Headings (MeSH); PubMed,Office of Engagement and Training,User,05/28/2020 12:00:00 AM,01/12/2018 12:00:00 AM
L000854112,2019 MeSH Highlights,https://www.nlm.nih.gov/bsd/disted/clinics/mesh_2019.html,"On January 4, 2019, NLM staff provided a highlights tour of the 2019 Medical Subject Headings (MeSH). A 20-minute presentation featured new publication types, including systematic reviews; three deleted subheadings; and additional terminology for data, neoplasms and more.",false,MP4 Video,Webinar,30,Medical Subject Headings (MeSH); PubMed,Office of Engagement and Training,User; Trainer; Developer,06/16/2020 12:00:00 AM,06/16/2020 12:00:00 AM
L001321112,2020 MeSH Highlights,https://www.nlm.nih.gov/oet/ed/mesh/2020_mesh_highlights.html,"On January 10, 2020, Sarah Helson from the National Library of Medicine highlighted new and important changes for 2020 MeSH.  A 20-minute presentation included a new publication type, ""Randomized Controlled Trial, Veterinary,"" new MeSH ""as Topic"" Headings, and a new tree structure for Infections.",false,MP4 Video,Webinar,46,Medical Subject Headings (MeSH); PubMed,Office of Engagement and Training,User; Trainer; Developer,01/25/2021 12:00:00 AM,03/27/2020 12:00:00 AM
L001961112,2021 MeSH Highlights,https://www.nlm.nih.gov/oet/ed/mesh/2021_mesh_highlights.html,"Every year, updates are made to MeSH, the NLM controlled vocabulary thesaurus used for indexing articles for PubMed. This annual webinar aims to introduce those changes and provide examples of how the changes may affect you as a PubMed searcher. For more information about MeSH, see the MeSH homepage.",false,MP4 Video,Webinar,53,Medical Subject Headings (MeSH); PubMed,Office of Engagement and Training,User; Trainer; Developer,01/18/2023 12:00:00 AM,02/17/2021 12:00:00 AM
L002741112,2022 MeSH Highlights,https://www.nlm.nih.gov/oet/ed/mesh/2022_mesh_highlights.html,"On January 12, 2022, Louise To and a panel of experts from the National Library of Medicine presented the webinar, 2022 MeSH Highlights. The webinar summarizes the changes for the 2022 MeSH featuring examples of new and updated terminology related to:  COVID-19 and other diseases; Social Determinants of Health; and Population Groups",false,MP4 Video,Webinar,53,Health Services Research; Medical Subject Headings (MeSH),Office of Engagement and Training,User; Trainer; Developer,01/18/2023 12:00:00 AM,02/03/2022 12:00:00 AM
L003801112,2023 MeSH Highlights,https://www.nlm.nih.gov/oet/ed/mesh/2023/mesh_highlights.html,"On January 10, 2023, Louise To and a panel of experts from the National Library of Medicine presented the webinar, 2023 MeSH Highlights. This webinar summarizes the changes for the 2023 MeSH. This presentation features examples of new and updated terminology followed by a Q&A session with NLM Indexing and Mesh experts.",false,MP4 Video,Webinar,56,Medical Subject Headings (MeSH),Office of Engagement and Training,User,01/18/2023 12:00:00 AM,01/18/2023 12:00:00 AM
L004321112,A Biology Student’s Guide to Finding & Organizing NCBI Data for Research Projects,https://www.nlm.nih.gov/ncbi/workshops/2023-06_organizing-biology-data/workshop-details.html,"All biology research projects involve finding relevant literature and identifying related biological information. Often high school or new undergraduate students need guidance on how to effectively search for helpful information. For almost 35 years, the NCBI has provided free access to high-quality biological databases for the research community. In addition, we’ve created tools to help organize selected literature and biological data records for quick and easy access.",false,HTML,Webinar Source Page,169,Genetics and Molecular Biology; My NCBI; NCBI Workshops,"Training Team, NCBI",User; Trainer,07/25/2023 12:00:00 AM,06/29/2023 12:00:00 AM
L000888112,A Bird's Eye View of Health Data Standards,https://www.nlm.nih.gov/bsd/disted/video/clin_info/standards.html,"As part of the series, Clinical Information, Librarians and the NLM: from Health Data Standards to Better Health, Rex Robison from the U.S. National Library of Medicine provides a primer on health data standards, highlighting the role of the National Library of Medicine in terminology standards.",false,MP4 Video,Webinar,26,Terminology; Data Management; Data Science,Office of Engagement and Training,User,01/25/2021 12:00:00 AM,10/16/2018 12:00:00 AM
L001021112,A Bird's Eye View of Health Data Standards,https://www.nnlm.gov/training/class-catalog/birds-eye-view-health-data-standards,"This one-hour training session with videos and exercises is intended to introduce you to health data standards and how they are used, including relevant National Library of Medicine (NLM) products and services.",false,HTML,On-Demand Course,60,Terminology; Data Management; Data Science,Office of Engagement and Training,User; Trainer; Developer,03/20/2023 12:00:00 AM,09/01/2021 12:00:00 AM
L004441112,A Brief Introduction to RxNav,https://www.nlm.nih.gov/oet/ed/navigator/rxnav/launch.html,"RxNav is a web application powered by the RxNorm API. RxNav helps you search, browse, and navigate through several drug information sources, including RxNorm, RxTerms and MED-RT. RxNav can help you find drug names and codes from RxNorm's constituent vocabularies.  This NLM Navigator will familiarize you with the basic layout and features of RxNav, and will show you how to search for, browse, and explore RxNorm data.",false,HTML,Tutorial,15,Drugs and Chemicals; RxNorm; Data Management,Office of Engagement and Training,User; Developer,10/25/2023 12:00:00 AM,08/23/2023 12:00:00 AM
L002861112,A Practical Guide to Preprints: Accelerating Scholarly Communication,https://zenodo.org/record/5600535#.YinyiHrMJPa,A practical guide on preprints from the Dutch consortium of university libraries and the National library of the Netherlands (UKB) together with the Association of Universities in the Netherlands (VSNU) and the Dutch Research Council (NWO).,false,HTML,Page,,Preprints,External Organization,User,01/25/2023 12:00:00 AM,10/27/2021 12:00:00 AM
L003367112,A Voyage to Health - Lesson Plans,https://www.nlm.nih.gov/exhibition/avoyagetohealth/education/index.html,A Voyage to Health presents these educational resources for K-12 educators and college/university faculty. The resources present selected themes or visual items from the online exhibition as a part of instructional materials or self-directed learning. Students examine the rich content and primary sources in the exhibition in developing content knowledge and higher order thinking skills.,false,HTML,Page,,K-12 Education; History of Medicine,History of Medicine,User; Trainer,09/30/2022 12:00:00 AM,09/30/2022 12:00:00 AM
L003704112,"AIDS Posters and Stories of Public Health: A People's History of a Pandemic - Responding to AIDS: History, Politics, and Visual Culture - Lesson Plan",https://www.nlm.nih.gov/exhibition/aids-posters/resource-detail1.html,"This class resource presents six separate one-hour lessons, each of which introduce its main topics along with suggested readings and discussion questions that help students explore thematic and visual material in the AIDS, Posters, and Stories of Public Health: A People’s History of a Pandemic exhibition. The class resource allows students to explore the history of AIDS in the United States, visual culture and the role of imagery in the response to AIDS, and scientists’ and activists’ responses to AIDS. Responding to AIDS includes digitally available, visual and textual items related to HIV/AIDS, selected from NLM’s Digital Collections, Profiles in Science, PubMed Central and other sources, for students to view, read, and expand their understanding about diverse and complex factors in responding to a health crisis.",false,HTML,Page,,History of Medicine; HIV/AIDS,History of Medicine,User; Trainer,01/03/2023 12:00:00 AM,01/03/2023 12:00:00 AM
L001902112,"ALFA CoLab Presentation, ASHG2020",https://youtu.be/XM8HbSUNzfE,"This video is an introduction to and tutorial for using ALFA, the Allele Frequency Aggregator, at the National Center for Biotechnology Information (NCBI).",false,MP4 Video,YouTube Video,18,Genetics and Molecular Biology; Bioinformatics; Data Science,"Training Team, NCBI",User,12/01/2020 12:00:00 AM,11/02/2020 12:00:00 AM
L001524112,ALFA: Allele Frequency Data for Variant Analysis and Interpretation,https://www.youtube.com/watch?v=wii-V39YxGk,"Results from the Allele Frequency Aggregator (ALFA) project will help you interpret the biological impact of common and rare sequence variants. ALFA's initial release includes analysis of genotype data from ~100K unrestricted dbGaP subjects and provides high-quality allele frequency data now displayed on relevant dbSNP records. Eventually ALFA will analyze more than 1M subjects. In this webinar, you will learn about the data in the recent ALFA release, see how to access the data from the web, FTP, and how to programmatically retrieve data by positions, genes, and other attributes using eUtils and Variation Services API in Python.",false,MP4 Video,YouTube Video,,Genetics and Molecular Biology,"Training Team, NCBI",User,06/17/2020 12:00:00 AM,04/22/2020 12:00:00 AM
L001843112,ASAPbio Preprint FAQ,https://asapbio.org/preprint-info/preprint-faq,Frequently asked questions about preprints.,false,HTML,Page,,Preprints,External Organization,User,01/25/2023 12:00:00 AM,04/01/2021 12:00:00 AM
L003382112,About MedlinePlus,https://medlineplus.gov/about/,General information and information for developers about MedlinePlus.,false,HTML,Page,,MedlinePlus,"MedlinePlus Team, LO/PSD/RWS",User; Trainer,09/30/2022 12:00:00 AM,09/30/2022 12:00:00 AM
L001525112,Accelerate Genomics Discovery with SRA in the Cloud,https://www.youtube.com/watch?v=PoseTXa8LU8,"You will learn to best leverage the cloud to speed up research and discovery. We'll introduce you to new and existing tools and data including BigQuery, SRA Toolkit, and more. You'll hear about real workflows in the cloud, including an example of the work NCBI was able to accomplish in the cloud using SRA data and a case study from an SRA cloud customer. By the end of this webinar, you will know where to look for new cloud products from NCBI, access help information to get you started, and will have expanded your knowledge on how to run your analyses efficiently in the cloud.",false,MP4 Video,YouTube Video,,Genetics and Molecular Biology,"Training Team, NCBI",User,06/17/2020 12:00:00 AM,04/20/2020 12:00:00 AM
L003303112,Access Genome Data using NCBI Datasets in Galaxy,https://www.youtube.com/watch?v=8TR3OrlgtC4,"This is a quick introduction to using NCBI Datasets withing Galaxy.  NCBI Datasets lets you easily gather data from across NCBI databases. You can download gene, transcript, protein and genome sequences, annotation and metadata.",false,MP4 Video,YouTube Video,4,Genetics and Molecular Biology; NCBI Workshops,"Training Team, NCBI",User; Trainer,09/12/2022 12:00:00 AM,09/06/2022 12:00:00 AM
L00515080,AccessGUDID: Search and Download,https://www.youtube.com/watch?v=iWPkoBanBfY,"This video, authored by the Food and Drug Administration, demonstrates how to search for medical device information on the AccessGUDID web site.",false,MP4 Video,Quick Tour,4,SNOMEDCT; Terminology,"UMLS Team, LO/BSD/MMS",User,10/22/2018 12:00:00 AM,11/16/2016 12:00:00 AM
L004401112,Accessing NCBI Biology Resources Using EDirect for Command Line Novices,https://www.nlm.nih.gov/ncbi/workshops/2023-07_intro-to-edirect/workshop-video.html,"In this workshop, we will begin with an introduction to working in a command line environment and then show you how to use the EDirect suite to access data programmatically from several NCBI databases.",false,HTML,Webinar Source Page,108,NCBI Workshops,"Training Team, NCBI",User; Trainer,08/01/2023 12:00:00 AM,07/31/2023 12:00:00 AM
L002061112,Add Preprint Citations in My Bibliography,https://www.youtube.com/watch?v=VGTRQNNDbmM,Demonstrates how to add preprint citations to My Bibliography.,false,MP4 Video,YouTube Video,3,My NCBI; Preprints,"NIHMS Team, NCBI",User,04/28/2021 12:00:00 AM,01/27/2021 12:00:00 AM
L000785112,Advanced Workshop on SRA and dbGaP Data Analysis,https://www.youtube.com/watch?v=iCYq0eqpP-U&feature=youtu.be,"This webinar is intended for advanced users of SRA and dbGaP who have experience with RNA-Seq analysis, variant calling or metagenomic data and want to work with large genomic datasets, use cloud computing for analyzing genomic datasets and perform parallel work on genomic datasets. You will learn how to call variants from SRA and dbGaP with GATK, realign reads with HISAT2, view expression levels and variants, search SRA data rapidly, integrate with Spark and mount dbGaP to an EBS volume. You can follow this workshop in real time by using a preconfigured AMI: VDB-2.5.8.3 - ami-774d781d.",false,MP4 Video,YouTube Video,47,Terminology; Data Management; Data Science,"Training Team, NCBI",User,11/14/2018 12:00:00 AM,04/05/2016 12:00:00 AM
L003352112,Against the Odds: Making a Difference in Global Health - Lesson Plans,https://www.nlm.nih.gov/exhibition/againsttheodds/online_activities/index.html,"Against the Odds presents the following instructional resources for middle- and high-school students and educators. Use them to discover stories of people and places featured in the exhibition. And explore how you, too, can Get Involved in improving health for all.",false,HTML,Site,,K-12 Education; History of Medicine,History of Medicine,User; Trainer,09/30/2022 12:00:00 AM,09/30/2022 12:00:00 AM
L003981112,All of Us Researcher Workbench webinar for academic libraries,https://www.nlm.nih.gov/oet/ed/aou/2023/love_data_week.html,"The All of Us Research Program is a key component of the Precision Medicine Initiative, which aspires to leverage advances in genomics and health information technology to accelerate biomedical discoveries.   The webinar will cover the basics of the All of Us Research Program, and the All of Us Researcher Workbench, a cloud-based research platform that the All of Us Research Program has created, where individuals can apply for access to the data, and once approved as Authorized Data Users, create project-specific Workspaces in which to access and analyze the data. Topics will include the data available, how to expand access to your campus community, and the available training resources. Search for your institution online to find out if your institution already has access and use the All of Us Research Program dataset through the All of Us Researcher Workbench. If you do not have access at your institution, this webinar will instruct how your institution can get free access to the Workbench and provide resources to help you get access.",false,HTML,Webinar Source Page,43,Population Groups; Data Science,Network of the National Library of Medicine,User; Trainer,03/07/2023 12:00:00 AM,03/06/2023 12:00:00 AM
L000939112,An Introduction to Evidence Based Practice: A Librarian's Guide - 1 - Introduction to EBP and PICO,https://youtu.be/UxVFfSrx1Sc,"After completing this webinar, participants should be able to:-Explain the importance and steps of evidence-based practice-Identify the role of the librarian in teaching, practicing, and supporting evidence-based practice-Formulate a clinical question based on the scope of the requestor's problem, PICO, and question type",false,MP4 Video,Webinar,55,PubMed,Network of the National Library of Medicine,User,05/28/2020 12:00:00 AM,03/15/2019 12:00:00 AM
L000938112,An Introduction to Evidence Based Practice: A Librarian's Guide - 2 - Searching,https://youtu.be/anbTseIKrmw,"After completing this class, participants should be able to:-Locate background and foreground information-Develop effective search strategies in order to find relevant evidence",false,MP4 Video,Webinar,61,PubMed,Network of the National Library of Medicine,User,05/28/2020 12:00:00 AM,03/15/2019 12:00:00 AM
L000937112,An Introduction to Evidence Based Practice: A Librarian's Guide - 3 - Appraisal and Application,https://youtu.be/kC-QDYR9E1I,"After completing this class, participants should be able to:-Describe study designs and the hierarchy of evidence-Choose appropriate study design based on question type-Apply descriptive and inferential statistics to understand research findings studies",false,MP4 Video,Webinar,52,PubMed,Network of the National Library of Medicine,User,05/28/2020 12:00:00 AM,03/15/2019 12:00:00 AM
L003201112,An Introduction to NCBI Cloud Computing for Biologists,https://www.nlm.nih.gov/oet/ed/ncbi/2022_07_cloud.html,"In this workshop, you will get hands-on experience with the AWS cloud environment using a combination of web-based and Linux command-line tools. his workshop is designed for experimental biologists without cloud computing experience.",false,HTML,Webinar Source Page,141,Genetics and Molecular Biology; Other; NCBI Workshops,"Training Team, NCBI",User,08/01/2022 12:00:00 AM,08/01/2022 12:00:00 AM
L002806112,An Introduction to NCBI Cloud Computing for Biologists,https://www.nlm.nih.gov/oet/ed/ncbi/2021_11_cloud.html,"On November 16, 2021, the NCBI Education Team provided a workshop on NCBI Cloud Computing for Biologists. Training materials from this event are available on this page.  As DNA sequencing becomes a commonplace tool in biological research, the need for accessible, scalable, and secure computational environments to process this deluge of data is growing. NCBI has partnered with leading cloud computing providers to provide tools and data to this growing industry. This workshop is designed for experimental biologists without cloud computing experience. While not required, it is most useful for researchers who do sequence-based research and who have some familiarity interacting with a Linux command-line.",false,HTML,Webinar Source Page,180,Genetics and Molecular Biology; NCBI Workshops,"Training Team, NCBI",User,02/18/2022 12:00:00 AM,11/16/2021 12:00:00 AM
L002901112,An Introduction to NCBI Cloud Computing for Virologists,https://www.nlm.nih.gov/oet/ed/ncbi/2022_02_cloud.html,This workshop is designed for virologists without cloud computing experience.,false,HTML,Webinar Source Page,171,Other; NCBI Workshops,"Training Team, NCBI",User; Trainer,03/14/2022 12:00:00 AM,03/14/2022 12:00:00 AM
L004461112,An Introduction to Pathogen Data at NCBI,https://www.nlm.nih.gov/ncbi/workshops/2023-07_intro-to-pathogen-data/workshop-details.html,"Over the years, NCBI has collected a vast amount of sequence information including from organisms considered pathogenic to others, including certain viruses, bacteria and fungi.  With all of the databases and tools available at NCBI, it is sometimes daunting to know where to start looking for and find data of interest. This workshop is for those interested in microbial or pathogen research and who are new to or would like a more structured way to find relevant data on the NCBI website.",false,HTML,Webinar Source Page,115,Genetics and Molecular Biology; Data Science; NCBI Workshops,"Training Team, NCBI",User; Trainer,08/25/2023 12:00:00 AM,08/24/2023 12:00:00 AM
L003562112,An Introduction to PubChem for Life Scientists,https://www.nlm.nih.gov/ncbi/workshops/2022-11_intro-to-pubchem/workshop-details.html,"Scientists and educators from many different fields need to find and understand chemical data to perform their work. As such, understanding PubChem, the world’s largest collection of freely accessible chemical information, is a powerful skill for researchers, educators, clinicians, and more. In this workshop, participants will have access to NCBI experts and be introduced to the functionality of the PubChem Database.",false,HTML,Webinar Source Page,82,Drugs and Chemicals; PubChem,"Training Team, NCBI",User; Trainer,12/01/2022 12:00:00 AM,11/17/2022 12:00:00 AM
L004281112,An Introduction to PubChem for Life Scientists,https://www.nlm.nih.gov/ncbi/workshops/2023-06_intro-to-pubchem/workshop-details.html,"Scientists and educators from many different fields need to find and understand chemical data to perform their work. As such, understanding PubChem, the world’s largest collection of freely accessible chemical information, is a powerful skill for researchers, educators, clinicians, and more. In this workshop, participants will have access to NCBI experts and be introduced to the functionality of the PubChem Database.",false,HTML,Webinar Source Page,117,Drugs and Chemicals; PubChem,"Training Team, NCBI",User; Trainer,07/11/2023 12:00:00 AM,07/10/2023 12:00:00 AM
L002521112,"An Introduction to PubMed, PubMed Central and NCBI Accounts for Researchers",https://www.nlm.nih.gov/oet/ed/ncbi/2021_12_pubmed.html,"On December 16, 2021 the NCBI Education Team provided the workshop: An Introduction to PubMed, PubMed Central and NCBI Accounts for Researchers. Training materials from this event are available on this page.  PubMed has over 33 million citations in the areas of biomedicine and health, and related scientific fields. However, the volume of citations in this database can make it difficult for new searchers to find relevant citations and links to full-text articles to support research projects.  This workshop was designed to provide a guided experience for novice searchers as well as provide some tips on how to use an NCBI account to more effectively use PubMed.",false,HTML,Webinar Source Page,64,My NCBI; PubMed; PubMed Central; Public Access; NCBI Workshops,"Training Team, NCBI",User,05/17/2023 12:00:00 AM,12/16/2021 12:00:00 AM
L002804112,An NCBI Guide to Finding and Analyzing Metagenomic Data,https://www.nlm.nih.gov/oet/ed/ncbi/2021_10_meta.html,"This workshop is designed for researchers to gain hands-on experience with accessing and analyzing metagenomic data using the various relevant resources available on the NCBI website. Additionally, some exercises in this workshop will provide experience with a Jupyter Notebook for bash- and python-based accessing and processing of this metagenomic data.",false,HTML,Webinar Source Page,97,Genetics and Molecular Biology; NCBI Workshops,"Training Team, NCBI",User,02/18/2022 12:00:00 AM,10/26/2021 12:00:00 AM
L001401112,An Overview of NLM's Post-TOXNET Resources,https://players.brightcove.net/5527299009001/default_default/index.html?videoId=6146633966001,"This webinar describes where former users of TOXNET can now go for information. For example, overviews of where the databases are now located are provided by a “TOXNET Has Moved” web page and an NLM “TOXNET Update: New Locations for TOXNET Content” Technical Bulletin article. The rest of the webinar provides an overview and examples of the toxicology- and chemical safety-related information now available in PubChem. Key for former users of TOXNET is that Hazardous Substances Data Bank (HSDB) content now exists as data fields in PubChem substance records.",false,HTML,Webinar Source Page,60,Drugs and Chemicals; Toxicology,Office of Engagement and Training,User,03/20/2023 12:00:00 AM,04/02/2020 12:00:00 AM
L002808112,An Update on NCBI BLAST and Other Sequence Analysis Tools,https://www.nlm.nih.gov/oet/ed/ncbi/2022_01_blast.html,"On January 25, 2022, the NCBI Education Team provided the workshop: An Update on NCBI BLAST and Other Sequence Analysis Tools. Training materials from this event are available on this page.  This virtual workshop highlights new displays and features and introduces best practices for use of NCBI BLAST services. You will learn when and how to use important but often misunderstood aspects of the BLAST programs, specialized services, and databases. You will explore other important sequence analysis services, including Primer BLAST, an oligonucleotide primer designer and specificity checker, and COBALT, a multiple protein sequence alignment tool. Finally, you will see brief demonstrations of standalone BLAST and related tools, including SRA-Toolkit BLAST and Magic-BLAST.",false,HTML,Webinar Source Page,,Genetics and Molecular Biology; NCBI Workshops,"Training Team, NCBI",User,02/18/2022 12:00:00 AM,01/25/2022 12:00:00 AM
L002383112,"An Update to SciENcv, the Science Experts Network Curriculum Vitae",https://www.youtube.com/watch?v=eGyHX85DIcE,"A minor update incorporating changes made to the NIH biosketch format for submissions beginning on or after May 25, 2021",false,MP4 Video,YouTube Video,4,Other; SciENcv,"Training Team, NCBI",User; Trainer,09/13/2021 12:00:00 AM,08/17/2021 12:00:00 AM
L004061112,Analyze Evolutionary Relationships Between Two Genomes using NCBI's Comparative Genome Viewer (CGV),https://www.youtube.com/watch?v=_TA86Tu1N0c,"This is a tutorial showing how to use CGV to view assembly-assembly alignments, including cross-species alignments.  The Comparative Genome Viewer (CGV) became available in 2022 and continues to be updated and expanded.",false,MP4 Video,YouTube Video,6,Genetics and Molecular Biology,"Training Team, NCBI",User; Trainer,04/10/2023 12:00:00 AM,04/05/2023 12:00:00 AM
