Resource ID,Resource Name,Resource URL,Description,Archived,Format,Type,Runtime,Subject Areas,Authoring Organization,Intended Audiences,Record Modified,Resource Revised
L000847112,NNLM Resource Picks: LactMed and Livertox,https://youtu.be/DdD85SlG2Xk,"The purpose of this NNLM Resource Picks presentation is to familiarize participants with the drug toxicity resources LactMed and Livertox available online from the National Library of Medicine. The live session will include an overview and search demonstrations for each database. LactMed contains information on drugs, dietary supplements, and other chemicals to which breastfeeding mothers might be exposed. It includes information on the levels of those substances in breast milk and infant blood, as well as possible adverse effects in a nursing infant. LiverTox provides information about drug induced liver injury caused by prescription and nonprescription drugs, herbals and dietary supplements.Presenter: James E. Knoben, PharmD, MPH, FAPhA serves as Drug Information Consultant in the Specialized Information Services Division, National Library of Medicine. He provides expert advice to NLM with respect to drug-related databases and serves as the NLM editor for LactMed and LiverTox.Presenter: Philip O. Anderson, Pharm.D., FCSHP, FASHP is the author of LactMed and a Health Sciences Clinical Professor of Pharmacy at the UCSD Skaggs School of Pharmacy and Pharmaceutical Sciences where he heads the course on drug information.The National Network of Libraries of Medicine is funded by the National Library of Medicine, National Institutes of Health, Department of Health and Human Services. Learn more at https://nnlm.gov",false,MP4 Video,Webinar,61,Bookshelf; Drugs and Chemicals; Toxicology,Network of the National Library of Medicine,User; Trainer,07/06/2020 12:00:00 AM,12/04/2018 12:00:00 AM
L003481112,NNLM Toolkit for the NIH Data Management and Sharing Policy,https://www.nnlm.gov/guides/nnlm-toolkit-nih-data-management-and-sharing-policy,"A selection of guides, toolkits, and other resources for librarians working on addressing the NIH Data Management and Sharing Policy.",false,HTML,Page,,Data Management,Network of the National Library of Medicine,User; Trainer,11/10/2022 12:00:00 AM,11/04/2022 12:00:00 AM
L003236112,National Library of Medicine (NLM) History of Medicine Collections,https://www.nnlm.gov/BrHGb,"Iincludes historical material related to health and disease. This brief guide to the NLM History of Medicine Collections is designed to quickly orient people who do outreach and training about the resource: Who uses it, for what, and how. The guide also includes teaching examples and alternative resources.",false,PDF,Document,,History of Medicine; Other,Network of the National Library of Medicine,Trainer,09/12/2023 12:00:00 AM,08/12/2022 12:00:00 AM
L00618080,Nursing Resources for Standards and Interoperability,https://www.nlm.nih.gov/research/umls/Snomed/nursing_terminology_resources.html,The video demonstrates how to use UMLS Metathesaurus to find CUIs and extract concept-level synonyms between SNOMED CT and other nursing terminologies.,false,HTML,Page,,SNOMEDCT; Unified Medical Language System (UMLS); UTS; Terminology; Clinical Medicine; Nursing,"UMLS Team, LO/BSD/MMS",User,12/28/2020 12:00:00 AM,01/11/2017 12:00:00 AM
L003228112,Open-i,https://www.nnlm.gov/BqKpw,"A resource that allows people to search and retrieve over 3.7 million abstracts and images from open-source literature and biomedical image collections. This brief guide to Open-i is designed to quickly orient people who do outreach and training about the resource: Who uses it, for what, and how. The guide also includes teaching examples and alternative resources.a resource that allows people to search and retrieve over 3.7 million abstracts and images from open-source literature and biomedical image collections. This brief guide to Open-i is designed to quickly orient people who do outreach and training about the resource: Who uses it, for what, and how. The guide also includes teaching examples and alternative resources.a resource that allows people to search and retrieve over 3.7 million abstracts and images from open-source literature and biomedical image collections. This brief guide to Open-i is designed to quickly orient people who do outreach and training about tha resource that allows people to search and retrieve over 3.7 million abstracts and images from open-source literature and biomedical image collections. This brief guide to Open-i is designed to quickly orient people who do outreach and training about the resource: Who uses it, for what, and how. The guide also includes teaching examples and alternative resources.e resource: Who uses it, for what, and how. The guide also includes teaching examples and alternative resources.",false,PDF,Document,,Other; Images,Network of the National Library of Medicine,Trainer,09/12/2023 12:00:00 AM,08/12/2022 12:00:00 AM
L001121112,Opening an RxNorm File in a Spreadsheet,https://www.nlm.nih.gov/research/umls/user_education/quick_tours/RxNorm/rxnorm_spreadsheet.html,This video demonstrates two methods to open an RxNorm file in a spreadsheet.,false,MP4 Video,Video Tutorial,5,Drugs and Chemicals; RxNorm; Terminology,"UMLS Team, LO/BSD/MMS",User,11/05/2020 12:00:00 AM,11/05/2019 12:00:00 AM
L003360112,"Outside/Inside: Immigration, Migration, and Health Care in the United States: Determinants of Health: Henry Street Visiting Nurses - Lesson Plan",https://www.nlm.nih.gov/exhibition/outsideinside/education-lessonplan1.html,"Students learn about various determinants of health using primary and secondary sources. To consider health determinants, students examine a selection of images and texts about the Henry Street Settlement Visiting Nurse Service from the 1930s.",false,HTML,Page,,K-12 Education; History of Medicine,History of Medicine,User; Trainer,09/30/2022 12:00:00 AM,09/30/2022 12:00:00 AM
L001861112,PREreview,https://www.prereview.org/,A platform for the crowdsourcing of preprint reviews.,false,HTML,Site,,Preprints,External Organization,User,01/25/2023 12:00:00 AM,01/01/2023 12:00:00 AM
L001863112,Peer Community In,https://peercommunityin.org/,A free recommendation process of scientific preprints based on peer-reviews.,false,HTML,Page,,Preprints,External Organization,User,01/25/2023 12:00:00 AM,12/21/2022 12:00:00 AM
L003761112,Phase 1 of the NIH Preprint Pilot: Testing the viability of making preprints discoverable in PubMed Central and PubMed,https://www.biorxiv.org/content/10.1101/2022.12.12.520156v1,This preprint article reports on phase 1 of the NIH Preprint Pilot.,false,HTML,Page,,PubMed; PubMed Central; Preprints,National Library of Medicine,User,01/13/2023 12:00:00 AM,12/23/2022 12:00:00 AM
L003372112,Physician Assistants: Collaboration and Care - Lesson Plans,https://www.nlm.nih.gov/exhibition/pa-collaborationandcare/education/index.html,"Physician Assistants: Collaboration and Care provides classroom resources for educators and students in secondary and higher education. These resources serve as starting points for further exploration into the contributions of physician assistants and the profession, and their role in providing high-quality health care in the United States and around the world. Educators are welcome to adapt these resources in whole or in part as appropriate for their students’ interests and learning goals.",false,HTML,Page,,K-12 Education; History of Medicine,History of Medicine,User; Trainer,09/30/2022 12:00:00 AM,09/30/2022 12:00:00 AM
L003361112,Pick Your Poison: Intoxicating Pleasures & Medical Prescriptions: DRUG USE AND ABUSE: Past and Present - Lesson Plan,https://www.nlm.nih.gov/exhibition/pickyourpoison/education/lesson-plans.html,"This lesson plan uses the historical case studies of five drugs—tobacco, alcohol, opiates, cocaine, and marijuana—featured in the online exhibition, Pick Your Poison: Intoxicating Pleasures and Medical Prescriptions. Students examine primary sources related to drug use and advertisement through 1800s and early 1900s, and identify three factors that influenced the use of those drug in the United States in the past. Students research contemporary information on the same drugs and compare their past use and current information that discourage young people from using/abusing the drugs. The lesson plan has been develop in collaboration with Lynn M. Wiegand who is a certified health education educator and school library media specialist in the Montgomery County, Maryland.",false,HTML,Page,,K-12 Education; History of Medicine,History of Medicine,User; Trainer,09/30/2022 12:00:00 AM,09/30/2022 12:00:00 AM
L003373112,Pictures of Nursing: The Zwerdling Postcard Collection - Lesson Plans,https://www.nlm.nih.gov/exhibition/picturesofnursing/education/lessonplan.html,"Pictures of Nursing presents the following classroom resources for K-12 and undergraduate educators and their students. The resources offer examples of how the rich content and primary sources in the exhibition can be used to promote students’ developing higher order thinking skills, in addition to expanding subject-area knowledge. Educators are welcome to adapt these resources in whole or in part as they deem appropriate for students’ interests and learning goals.",false,HTML,Page,,K-12 Education; History of Medicine,History of Medicine,User; Trainer,09/30/2022 12:00:00 AM,09/30/2022 12:00:00 AM
L003376112,Plain Language Checklist for Lay Brief Summaries,https://prsinfo.clinicaltrials.gov/Plain_Language_Checklist_for_Lay_Brief_Summaries.pdf,Study managers can use this checklist to write a “brief summary description” that follows the main evidence-based plain language best practices for writing lay research summaries. The goal is a brief description that the general public can easily understand and engage with.,false,PDF,Document,,ClinicalTrials.gov,"ClinicalTrials.gov Team, NCBI",User; Trainer,09/30/2022 12:00:00 AM,09/26/2022 12:00:00 AM
L003362112,Politics of Yellow Fever in Alexander Hamilton’s America: Yellow Fever in 1793 and Today - Lesson Plan,https://www.nlm.nih.gov/exhibition/politicsofyellowfever/education-lessonplan1.html,"Students examine the effects of the yellow fever outbreak in Philadelphia in 1793, then gather information on yellow fever prevention and treatment today.",false,HTML,Page,,K-12 Education; History of Medicine,History of Medicine,User; Trainer,09/30/2022 12:00:00 AM,09/30/2022 12:00:00 AM
L002442112,Preprints: Accelerating Research,https://www.nnlm.gov/training/class-catalog/preprints-accelerating-research,"What are preprints, and how are they changing how biomedical research results are shared? Should you use information from preprints? Should you share your own research results in a preprint? This course from the National Library of Medicine® explains the basics of preprints, and explores the benefits and considerations of using and submitting preprints.",false,HTML,On-Demand Course,60,Preprints,Office of Engagement and Training,User,01/17/2023 12:00:00 AM,01/16/2023 12:00:00 AM
L002443112,Preprints: Accelerating Research,https://www.nlm.nih.gov/oet/ed/pmc/preprints/preprints_SCORM.zip,"What are preprints, and how are they changing how biomedical research results are shared? Should you use information from preprints? Should you share your own research results in a preprint? This 1-hour online, self-paced course from the National Library of Medicine for researchers, librarians, and others explains the basics of preprints, and explores the benefits and considerations of using and submitting preprints.",false,ZIP,SCORM Package,60,Preprints,Office of Engagement and Training,Trainer; Developer,01/17/2023 12:00:00 AM,01/16/2023 12:00:00 AM
L002441112,Preprints: Accelerating Research (Tutorial),https://www.nlm.nih.gov/oet/ed/pmc/preprints/index.html,"What are preprints, and how are they changing how biomedical research results are shared? Should you use information from preprints? Should you share your own research results in a preprint? This 1-hour online, self-paced course from the National Library of Medicine for researchers, librarians, and others explains the basics of preprints, and explores the benefits and considerations of using and submitting preprints.",false,HTML,Tutorial,60,Preprints,Office of Engagement and Training,User,01/17/2023 12:00:00 AM,01/16/2023 12:00:00 AM
L002862112,Preprints: Their Evolving Role In Science Communication (E-book),https://doi.org/10.3998/mpub.12412508,This briefing discusses the history and role of preprints in the biological sciences within the evolving open science landscape. The focus is on the explosive growth of preprints as a publishing model and the associated challenges of maintaining technical infrastructure and establishing sustainable business models.,false,HTML,Page,,Preprints,External Organization,User,01/25/2023 12:00:00 AM,01/01/2022 12:00:00 AM
L002367112,Prescription and Over the Counter Drugs: Supporting Patients with Evidence-Based Information,https://www.nnlm.gov/training/class-catalog/prescription-and-over-counter-drugs-supporting-patients-evidence-based,"This 1 credit hour on-demand course will cover differences between prescription and over the counter medications, data regarding use in the United States, and three free resources from the National Library of Medicine and National Institutes of Health: the NIDA website, DailyMed and LactMed.  The course includes a recorded presentation, demos of the resources, and guided exercises to try the resources hands-on.",false,HTML,On-Demand Course,,Drugs and Chemicals; Other,Network of the National Library of Medicine,User; Trainer,10/21/2022 12:00:00 AM,08/18/2021 12:00:00 AM
L003421112,Privacy Research & Clinical Text Deidentification with NLM-Scrubber,https://youtu.be/3g5wCeDTjpA,"We strive to discover new clinical facts to promote evidence-based clinical sciences, but such potential discoveries are locked in electronic health record systems due to privacy concerns. Unfortunately, there is no silver bullet to resolve this vexing social concern. In this presentation, Dr. Mehmet Kayaalp deconstructs the problem to understand what makes privacy so complex. How can we tap into big health data while preserving the privacy of the patient? One technological solution is NLM-Scrubber, a clinical text de-identification tool developed at the National Library of Medicine. Dr. Kayaalp discusses what NLM-Scrubber offers to clinical scientists, data managers, and privacy officers in academic medical settings.",false,MP4 Video,YouTube Video,60,Clinical Medicine; Data Management,Network of the National Library of Medicine,User; Trainer; Developer,10/12/2022 12:00:00 AM,03/17/2020 12:00:00 AM
L001629112,Providing Multilingual and Multicultural Health Information,https://www.nnlm.gov/training/class-catalog/providing-multilingual-health-information,This class is designed to assist librarians and others who work with diverse populations in locating health information. The resources presented are selected for their emphasis on providing culturally relevant information in the preferred language of the population.,false,HTML,On-Demand Course,,Health Services Research,Network of the National Library of Medicine,Trainer,09/08/2023 12:00:00 AM,05/23/2022 12:00:00 AM
L003541112,Proximity Searching in PubMed,https://www.nlm.nih.gov/oet/ed/pubmed/quicktours/proximity/index.html,This tutorial demonstrates how to use proximity searching to find terms close to each other in PubMed. Search for multiple terms appearing in any order within a specified distance of one another in the [Title] or [Title/Abstract] fields.,false,MP4 Video,Quick Tour,4,PubMed,Office of Engagement and Training,User; Trainer,11/30/2022 12:00:00 AM,11/29/2022 12:00:00 AM
L003542112,Proximity Searching in PubMed,https://www.nlm.nih.gov/oet/ed/pubmed/quicktours/scorm/PubMed_Proximity_Searching_SCORM.zip,This tutorial demonstrates how to use proximity searching to find terms close to each other in PubMed. Search for multiple terms appearing in any order within a specified distance of one another in the [Title] or [Title/Abstract] fields.,false,ZIP,SCORM Package,4,PubMed,Office of Engagement and Training,Trainer,11/30/2022 12:00:00 AM,11/30/2022 12:00:00 AM
L003182112,PubChem,https://www.nlm.nih.gov/oet/ed/pubchem/tutorial/index.html,"This self-paced PubChem tutorial guides you through how to access chemical property and structure data that the hundreds of academic, government, and industrial sources contribute to PubChem.",false,HTML,Tutorial,120,Drugs and Chemicals; PubChem,Office of Engagement and Training,User; Trainer,10/17/2022 12:00:00 AM,07/22/2022 12:00:00 AM
L003232112,PubChem,https://www.nnlm.gov/Brq5S,"The world's largest collection of freely accessible chemical information. This brief guide to PubChem is designed to quickly orient people who do outreach and training about the resource: Who uses it, for what, and how. The guide also includes teaching examples and alternative resources.",false,PDF,Document,,Drugs and Chemicals; PubChem,Network of the National Library of Medicine,Trainer,09/12/2023 12:00:00 AM,08/12/2022 12:00:00 AM
L003181112,PubChem - On Demand,https://www.nnlm.gov/training/class-catalog/pubchem-tutorial,"This self-paced PubChem tutorial guides you through how to access chemical property and structure data that hundreds of academic, government and industrial sources contribute to PubChem.",false,HTML,On-Demand Course,120,Drugs and Chemicals; PubChem,Office of Engagement and Training,User; Trainer,10/21/2022 12:00:00 AM,07/22/2022 12:00:00 AM
L003641112,PubChem - SCORM tutorial,https://www.nlm.nih.gov/oet/ed/pubchem/tutorial/PubChem_SCORM.zip,"This self-paced PubChem tutorial guides you through how to access chemical property and structure data that the hundreds of academic, government, and industrial sources contribute to PubChem. This is the SCORM version for download and use in course management systems.",false,ZIP,SCORM Package,60,PubChem,Office of Engagement and Training,Trainer; Developer,12/20/2022 12:00:00 AM,07/22/2022 12:00:00 AM
L000661112,PubMed Essentials - On Demand,https://www.nnlm.gov/training/class-catalog/pubmed-essentials-demand,"If you’re new to PubMed or just want a refresher, this online class is designed for you. The class is made up of 10 short units that include videos, exercises and quizzes. The class gives you the chance to explore PubMed at your own pace with guided tours and exercises. This class takes about 1 hour to complete.",false,HTML,On-Demand Course,60,PubMed,Network of the National Library of Medicine,User,11/25/2022 12:00:00 AM,09/02/2021 12:00:00 AM
L003305112,PubMed Find Articles By Author,https://www.youtube.com/watch?v=I_Qq6Jf7sBI,A brief tutorial on how to find articles by an author using PubMed.,false,MP4 Video,YouTube Video,3,PubMed,Office of Engagement and Training,User; Trainer,10/26/2022 12:00:00 AM,09/07/2022 12:00:00 AM
L003281112,PubMed Find Articles from a Citation,https://www.youtube.com/watch?v=lgL6Oa-tj0E,A brief tutorial on how to find articles in PubMed using a citation.,false,MP4 Video,YouTube Video,1,PubMed,Office of Engagement and Training,User; Trainer,10/26/2022 12:00:00 AM,08/26/2022 12:00:00 AM
L003581112,PubMed Proximity Searching,https://www.youtube.com/watch?v=-pa3argv1XQ,This tutorial demonstrates how to use proximity searching to find terms close to each other in PubMed. Search for multiple terms appearing in any order within a specified distance of one another in the [Title] or [Title/Abstract] fields.,false,MP4 Video,YouTube Video,4,PubMed,Office of Engagement and Training,User; Trainer,12/05/2022 12:00:00 AM,11/30/2022 12:00:00 AM
L001262112,PubMed Subject Search: How It Works,https://www.nlm.nih.gov/oet/ed/pubmed/quicktours/scorm/PubMed_SubjectSearchHowItWorks.zip,A brief tutorial on how automatic term mapping and explosion enhance your PubMed search (SCORM version).,false,ZIP,SCORM Package,4,PubMed,Office of Engagement and Training,User; Trainer,12/22/2022 12:00:00 AM,12/22/2022 12:00:00 AM
L001261112,PubMed Subject Search: How It Works,https://www.nlm.nih.gov/oet/ed/pubmed/quicktours/topic_how_it_works/index.html,A brief tutorial on how automatic term mapping and explosion enhance your PubMed search.,false,MP4 Video,Quick Tour,4,PubMed,Office of Engagement and Training,User; Trainer,05/11/2023 12:00:00 AM,12/22/2022 12:00:00 AM
L003663112,PubMed Subject Search: How it Works,https://www.youtube.com/watch?v=S11S0EuJ0O8,A brief tutorial on how automatic term mapping and explosion enhance your PubMed search.,false,MP4 Video,YouTube Video,4,PubMed,Office of Engagement and Training,User; Trainer,12/27/2022 12:00:00 AM,12/22/2022 12:00:00 AM
L001701112,PubMed Update for the Medical Library Association (MLA) 2020 Virtual Conference,https://www.nlm.nih.gov/oet/exhibits/mla/2020/PubMed_Update.html,Marie Collins from the National Library of Medicine provides a PubMed update for the Medical Library Association (MLA) 2020 Virtual Conference.,false,MP4 Video,Webinar,17,PubMed,Office of Engagement and Training,User,10/26/2022 12:00:00 AM,07/23/2020 12:00:00 AM
L003861112,PubMed and MedlinePlus: Consumer Health,https://www.youtube.com/watch?v=s14qYid3EAU,Help patients and their families find research in PubMed using MedlinePlus.,false,MP4 Video,YouTube Video,5,MedlinePlus; PubMed,Office of Engagement and Training,User; Trainer,05/11/2023 12:00:00 AM,02/01/2023 12:00:00 AM
L001381112,PubMed and MedlinePlus: Consumer health,https://www.nlm.nih.gov/oet/ed/pubmed/quicktours/consumer/index.html,Help consumers find research in PubMed using MedlinePlus.,false,MP4 Video,Quick Tour,3,MedlinePlus; PubMed,Office of Engagement and Training,Trainer,02/01/2023 12:00:00 AM,01/31/2023 12:00:00 AM
L003301112,PubMed: Buscar artículos de una cita,https://www.youtube.com/watch?v=3Eqag5Welco&t=1s,Siga estas instrucciones para buscar artículos de una cita en PubMed.,false,MP4 Video,YouTube Video,1,PubMed,Office of Engagement and Training,User; Trainer,10/26/2022 12:00:00 AM,08/26/2022 12:00:00 AM
L002703112,PubMed: Buscar artículos de una cita | PubMed: Search for articles from a citation (Spanish),https://www.nlm.nih.gov/oet/ed/pubmed/quicktours-SP/citation/index.html,Siga estas instrucciones para buscar artículos de una cita en PubMed.,false,MP4 Video,Quick Tour,2,PubMed,Office of Engagement and Training,User,08/26/2022 12:00:00 AM,08/11/2022 12:00:00 AM
L003306112,PubMed: Buscar artículos por autor,https://www.youtube.com/watch?v=VCIj1ANcbL4,Siga estas instrucciones para buscar artículos por autor en PubMed.,false,MP4 Video,YouTube Video,3,PubMed,Office of Engagement and Training,User; Trainer,10/26/2022 12:00:00 AM,09/07/2022 12:00:00 AM
L002702112,PubMed: Buscar artículos por autor | PubMed: Search for articles by author (Spanish),https://www.nlm.nih.gov/oet/ed/pubmed/quicktours-SP/author/index.html,Siga estas instrucciones para buscar artículos por autor.,false,MP4 Video,Quick Tour,2,PubMed,Office of Engagement and Training,User,01/06/2022 12:00:00 AM,01/06/2022 12:00:00 AM
L003084112,PubMed: Buscar artículos por revista,https://www.youtube.com/watch?v=x7ttXy5SXWY,Siga estas instrucciones para buscar artículos por revista en PubMed. Aprende más de PubMed en el seccion “Recursos en español” en la pagina PubMed Online Training: https://www.nlm.nih.gov/oet/ed/pubmed/.,false,MP4 Video,YouTube Video,2,PubMed; Other,Office of Engagement and Training,User; Trainer; Developer,10/26/2022 12:00:00 AM,06/15/2022 12:00:00 AM
L002705112,PubMed: Buscar artículos por revista | PubMed: Search for articles by journal (Spanish),https://www.nlm.nih.gov/oet/ed/pubmed/quicktours-SP/journal/index.html,Siga estas instrucciones para buscar artículos por revista en PubMed.,false,MP4 Video,Quick Tour,2,PubMed,Office of Engagement and Training,User,06/13/2022 12:00:00 AM,06/10/2022 12:00:00 AM
L003082112,PubMed: Buscar artículos sobre un tema,https://www.youtube.com/watch?v=7rBxVCOmnPk,Este video describe como buscar artículos sobre un tema en PubMed. Aprende más de PubMed en el seccion “Recursos en español” en la pagina PubMed Online Training: https://www.nlm.nih.gov/oet/ed/pubmed/.,false,MP4 Video,YouTube Video,1,PubMed; Other,Network of the National Library of Medicine,User; Trainer; Developer,06/27/2022 12:00:00 AM,06/03/2022 12:00:00 AM
L002706112,PubMed: Buscar artículos sobre un tema | PubMed: Search for articles about a topic (Spanish),https://www.nlm.nih.gov/oet/ed/pubmed/quicktours-SP/topic/index.html,Como buscar artículos sobre un tema en PubMed.,false,MP4 Video,Quick Tour,1,PubMed,Office of Engagement and Training,User,06/03/2022 12:00:00 AM,06/01/2022 12:00:00 AM
L003662112,PubMed: Buscar los últimos tratamientos para una enfermedad o trastorno | PubMed: Find the Latest Treatments for a Disease or Disorder (Spanish),https://www.youtube.com/watch?v=MjkVRYE_o3I,Cómo buscar los últimos tratamientos para una enfermedad o trastorno en PubMed.,false,MP4 Video,YouTube Video,2,PubChem,Office of Engagement and Training,User; Trainer,12/27/2022 12:00:00 AM,12/20/2022 12:00:00 AM
L002708112,PubMed: Buscar los últimos tratamientos para una enfermedad o trastorno | PubMed: Search for the latest treatments (Spanish),https://www.nlm.nih.gov/oet/ed/pubmed/quicktours-SP/treatment/index.html,Cómo buscar los últimos tratamientos para una enfermedad o trastorno en PubMed.,false,MP4 Video,Quick Tour,3,PubMed,Office of Engagement and Training,User,12/20/2022 12:00:00 AM,12/20/2022 12:00:00 AM
L002707112,PubMed: Cómo funciona | PubMed: How it Works (Spanish),https://www.nlm.nih.gov/oet/ed/pubmed/quicktours-SP/topic_how_it_works/index.html,Cómo funciona PubMed.,false,MP4 Video,Quick Tour,4,PubMed,Office of Engagement and Training,User,12/22/2022 12:00:00 AM,12/22/2022 12:00:00 AM
